{
  "schema_version": "2.0.0",
  "data_version": "0.1.0-draft",
  "layout_id": "AIL-0001",
  "program_id": "AIP-0001",
  "width": 8,
  "height": 8,
  "chips": [
    {"instance_id": "node-search", "x": 0, "y": 0, "rotation": 0},
    {"instance_id": "node-state", "x": 2, "y": 0, "rotation": 0},
    {"instance_id": "node-action", "x": 4, "y": 0, "rotation": 0}
  ],
  "extensions": []
}
